{
  "contentId": "GAME-OVERSEAS-06",
  "language": "ko",
  "sourceLanguage": "ko",
  "translationOf": "card-data.en.json",
  "canvasProfile": "portrait",
  "visualFamily": "social-native",
  "series": "게임 인허가",
  "issue": "No.06",
  "totalPages": 10,
  "angle": "해외 게임의 한국 출시 절차는 서버 위치가 아니라 실제 서비스 구조에서 출발한다.",
  "marketing": {
    "targetReader": "한국 출시를 준비하는 해외 게임사와 국내 퍼블리셔",
    "readerQuestion": "해외 서버와 해외 법인 구조에서 한국 출시의 책임 주체와 선행 절차는 무엇인가",
    "practicalPayoff": "서비스 구조를 여섯 질문으로 정리하고 등급분류·등록·국내대리인 검토 순서를 잡을 수 있다.",
    "coverIntent": "싱가포르 서버와 한국 법인 부재라는 구체 상황에서 책임 주체를 질문한다.",
    "saveValue": "한국 출시 구조를 정리하는 여섯 질문과 국내대리인 지정 기준",
    "ctaInputs": [
      "서비스 국가",
      "플랫폼",
      "계약 구조"
    ],
    "ctaOutcomes": [
      "등급분류",
      "배급업 등록",
      "국내대리인 검토 순서"
    ],
    "performanceHypothesis": "구체적인 서비스 구조 질문형 표지가 저장과 프로필 방문을 높이는지 확인한다."
  },
  "editorialReview": {
    "pipelineVersion": "2.0",
    "naturalDraft": "pass",
    "factCheck": "pending",
    "marketingPass": "pass",
    "forbiddenExpressionPass": "pass",
    "languagePass": "manual-equivalent",
    "semanticRecheck": "pending",
    "reviewNote": "비교용 초안. 원문(blog.md)의 사실만 사용해 카피·컴포넌트를 재설계했고, 1차 법령 재대조와 사용자 승인은 아직 하지 않음"
  },
  "approvedBy": "비교용 초안 — 사용자 승인 전. 발행 금지",
  "omittedSections": [
    "확률형 아이템 모니터링 통계",
    "계약상 자료제공 세부항목",
    "행정사 업무범위 설명"
  ],
  "cards": [
    {
      "page": 1,
      "type": "cover",
      "bg": "navy",
      "takeStyle": "bar",
      "oneMessage": "서버 위치보다 한국 서비스 구조가 중요하다.",
      "headline": "서버는 싱가포르, 한국 법인은 없습니다. 이대로 한국에 출시해도 될까요?",
      "body": [
        "중요한 건 서버 위치나 게임의 국적이 아니라, 한국에서 누가 어떻게 유통·제공하느냐입니다."
      ],
      "takeaway": "서비스 구조가 정해지면, 절차의 주체도 보입니다.",
      "pageTurn": "서버만 보고 결론 내릴 수 없는 이유",
      "sourceTrace": {
        "heading": "서론",
        "paragraph": "게임은 해외에서 만들었고 서버도 해외에 있는데",
        "evidence": "I",
        "compressionNote": "사례와 핵심 질문을 표지용으로 결합 [v2] 카드 컴포넌트·카피 재설계. 사실·한정어는 원문 범위 유지",
        "omittedQualification": "개별 게임의 구체적 구조에 따라 달라질 수 있음"
      },
      "promise": "출시 전에 답할 6가지 질문"
    },
    {
      "page": 2,
      "type": "quote",
      "bg": "cream",
      "takeStyle": "close",
      "oneMessage": "해외 서버만으로 등급분류 검토가 사라지지 않는다.",
      "headline": "해외 서버라도 한국 등급분류는 따져봐야 합니다",
      "body": [
        "대법원 2008도3970 · 2008년 10월 23일",
        "법정 예외가 아니라면 서버가 국내인지 해외인지로 등급분류 의무를 달리 볼 수 없다고 판단했습니다.",
        "다만 현재는 자체등급분류와 해외게임물 특례가 있어 이 판결을 모든 절차에 그대로 대입해서는 안 됩니다."
      ],
      "takeaway": "그래서 서버 위치보다 서비스 구조부터 봅니다.",
      "pageTurn": "먼저 네 주체의 역할을 구분",
      "sourceTrace": {
        "heading": "1. 서버가 해외에 있으면 한국 등급분류를 받지 않아도 될까요?",
        "paragraph": "대법원 2008도3970",
        "evidence": "F",
        "compressionNote": "판결 취지와 현행 제도에 관한 단서를 함께 보존"
      }
    },
    {
      "page": 3,
      "type": "flow",
      "bg": "navy",
      "takeStyle": "close",
      "oneMessage": "네 주체의 법적 역할은 서로 다르다.",
      "headline": "한국 출시에 얽힌 네 가지 역할, 한 줄로 보기",
      "body": [
        {
          "key": "해외 개발사",
          "text": "게임과 서비스 권한을 보유"
        },
        {
          "key": "국내 퍼블리셔",
          "text": "한국 서비스·유통을 담당"
        },
        {
          "key": "플랫폼",
          "text": "자체등급분류사업자 — 법에 따라 지정받아 등급을 직접 분류"
        },
        {
          "key": "한국 이용자",
          "text": "한국에서 게임을 이용"
        }
      ],
      "takeaway": "국내 퍼블리셔와 국내대리인은 서로 다른 역할입니다.",
      "pageTurn": "국내 퍼블리셔가 항상 필요한지",
      "sourceTrace": {
        "heading": "2. 해외게임 한국 출시에서 먼저 구분해야 할 주체는 4명입니다",
        "paragraph": "대표적으로 네 주체가 있습니다",
        "evidence": "F",
        "compressionNote": "각 주체의 핵심 기능만 남김 [v2] 카드 컴포넌트·카피 재설계. 사실·한정어는 원문 범위 유지"
      },
      "note": "여기에 일정 규모 이상의 해외 게임사는 국내대리인(연락·의무이행을 맡는 국내 주체)도 지정해야 합니다."
    },
    {
      "page": 4,
      "type": "comparison",
      "bg": "cream",
      "takeStyle": "bar",
      "oneMessage": "외국에서 개발했다는 사실만으로 해외게임물 특례가 적용되지는 않는다.",
      "headline": "퍼블리셔 없이 가는 길도 있지만, 조건이 있습니다",
      "body": [
        "가능한 구조: 글로벌 서비스에 한국 이용을 추가하고, 자체등급분류사업자가 법정 요건에 따라 제공",
        "별도 검토가 필요한 구조: 처음부터 한국을 핵심 시장으로 삼아 국내 전용 서비스와 계약을 설계"
      ],
      "takeaway": "해외게임물 특례는 어디서 만들었는지가 아니라, 국내 유통이 주된 목적인지에 따라 갈립니다.",
      "pageTurn": "플랫폼이 바뀔 때 등급효력 확인",
      "sourceTrace": {
        "heading": "3. 해외게임은 반드시 국내 퍼블리셔를 선정해야 할까요?",
        "paragraph": "법에서 말하는 해외 게임물은",
        "evidence": "F",
        "compressionNote": "원문의 두 사례를 비교 구조로 압축",
        "omittedQualification": "구체적 요건은 실제 서비스 구조별 확인 필요"
      }
    },
    {
      "page": 5,
      "type": "table",
      "bg": "navy",
      "takeStyle": "close",
      "oneMessage": "해외게임 특례와 플랫폼별 등급효력은 자동으로 이어지지 않는다.",
      "headline": "이럴 땐 등급 경로를 따로 확인하세요",
      "body": [
        {
          "key": "청소년이용불가 게임",
          "text": "해외게임물 특례에서 제외됩니다"
        },
        {
          "key": "게임제공업용 게임",
          "text": "청소년게임제공업·일반게임제공업에 제공되는 게임도 제외됩니다"
        },
        {
          "key": "다른 플랫폼에서 유통",
          "text": "다른 자체등급분류사업자가 유통하려면 새로 등급분류를 받아야 합니다"
        }
      ],
      "takeaway": "유통 경로와 예상 등급을 함께 확인하세요.",
      "pageTurn": "국내 퍼블리셔가 들어오면 실제 업무를 확인",
      "sourceTrace": {
        "heading": "4. 청소년이용불가 게임도 플랫폼을 통해 같은 방식으로 출시하면 될까요? / 5. 앱마켓 A에서 받은 등급을 플랫폼 B에서도 그대로 사용할 수 있을까요?",
        "paragraph": "게임의 유통경로와 예상등급을 함께 봐야 합니다",
        "evidence": "F",
        "compressionNote": "두 조문의 적용 경계를 한 카드에 병렬 배치 [v2] 카드 컴포넌트·카피 재설계. 사실·한정어는 원문 범위 유지"
      },
      "head": [
        "상황",
        "등급 처리"
      ]
    },
    {
      "page": 6,
      "type": "checklist",
      "bg": "cream",
      "takeStyle": "close",
      "layout": "questions",
      "oneMessage": "퍼블리셔라는 명칭보다 실제 업무를 봐야 한다.",
      "headline": "국내 퍼블리셔가 있다면 이름보다 실제 업무를 보세요",
      "body": [
        "누가 게임을 수입하나요?",
        "누가 저작권을 소유·관리하나요?",
        "누가 게임제공업자 등에게 공급하나요?"
      ],
      "takeaway": "게임배급업이란 게임을 수입하거나 저작권을 소유·관리하면서 공급하는 영업입니다. 해당 여부와 등록을 검토하세요.",
      "pageTurn": "국내대리인이 대신하지 못하는 업무",
      "sourceTrace": {
        "heading": "6. 국내 퍼블리셔가 들어오면 누가 게임배급업 등록을 해야 할까요?",
        "paragraph": "계약서상 명칭이 단순히 퍼블리셔라는 것만으로",
        "evidence": "F",
        "compressionNote": "판단 요소를 세 질문으로 편집"
      }
    },
    {
      "page": 7,
      "type": "comparison",
      "bg": "navy",
      "takeStyle": "bar",
      "oneMessage": "국내대리인은 퍼블리셔와 등급분류를 대신하지 않는다.",
      "headline": "국내대리인만 지정하면 한국 절차는 끝일까요?",
      "body": [
        "국내대리인이 맡는 일: 게임산업법상 보고 이행, 게임물 표시의무 이행",
        "지정만으로 대신하지 않는 일: 국내 퍼블리셔의 역할, 게임배급업 등록, 모든 등급분류 절차"
      ],
      "takeaway": "국내대리인 지정과 한국 출시 절차의 완료는 별개입니다.",
      "pageTurn": "지정 대상 기준 확인",
      "sourceTrace": {
        "heading": "8. 2025년부터 생긴 국내대리인은 국내 퍼블리셔와 무엇이 다를까요?",
        "paragraph": "법에서 정한 국내대리인의 핵심 업무",
        "evidence": "F",
        "compressionNote": "법정 업무와 비대체 업무를 대비 [v2] 카드 컴포넌트·카피 재설계. 사실·한정어는 원문 범위 유지"
      }
    },
    {
      "page": 8,
      "type": "checklist",
      "bg": "cream",
      "takeStyle": "close",
      "oneMessage": "국내대리인 지정 기준은 세 갈래다.",
      "headline": "국내대리인 지정 기준, 세 가지 중 하나면 해당",
      "body": [
        {
          "key": "1조 원",
          "text": "전년도 전체 매출액 1조 원 이상"
        },
        {
          "key": "1천 건/일",
          "text": "전년도 국내 판매 이동통신단말장치에서 하루 평균 설치 1천 건 이상인 게임을 배급·제공"
        },
        {
          "key": "보고 요구",
          "text": "유통질서를 현저히 해칠 우려로 문체부장관의 보고 요구를 받은 경우"
        }
      ],
      "takeaway": "지정대상인데 국내대리인을 두지 않으면 2천만 원 이하 과태료 대상이 될 수 있습니다.",
      "pageTurn": "직접 준비할 수 있는 범위 구분",
      "sourceTrace": {
        "heading": "8. 2025년부터 생긴 국내대리인 / 9. 국내대리인을 지정하지 않으면",
        "paragraph": "2026년 현재 시행령상 기준",
        "evidence": "F",
        "compressionNote": "법정 기준과 과태료만 보존"
      }
    },
    {
      "page": 9,
      "type": "table",
      "bg": "navy",
      "takeStyle": "close",
      "oneMessage": "여섯 질문을 순서대로 답하면 한국 서비스 구조가 보인다.",
      "headline": "6가지 질문에 답하면, 필요한 절차가 정해집니다",
      "body": [
        {
          "key": "① 누가 배급하나요?",
          "text": "한국 서비스 구조와 등급분류 신청 주체"
        },
        {
          "key": "② 누가 이용자에게 제공하나요?",
          "text": "본사 직접인지, 퍼블리셔·플랫폼 경유인지"
        },
        {
          "key": "③ 어떤 플랫폼을 쓰나요?",
          "text": "플랫폼별 등급효력이 미치는 범위"
        },
        {
          "key": "④ 누가 등급을 처리하나요?",
          "text": "해외게임물 특례·자체등급·일반 경로 중 선택"
        },
        {
          "key": "⑤ 누가 국내 등록대상인가요?",
          "text": "게임배급업 등록 여부"
        },
        {
          "key": "⑥ 누가 출시 후 표시와 보고를 맡나요?",
          "text": "출시 후 의무, 국내대리인 지정 여부"
        }
      ],
      "takeaway": "여섯 답이 정리되면 등급·등록·사후 절차가 한 흐름으로 이어집니다.",
      "pageTurn": "직접 준비와 종합 검토의 경계",
      "sourceTrace": {
        "heading": "12. 한국 출시 전에 실제로는 어떤 순서로 정리해야 할까요?",
        "paragraph": "이 여섯 가지가 맞아야 한국 서비스 구조가 정리됩니다",
        "evidence": "S",
        "compressionNote": "출시 순서를 저장용 프로세스로 전환 [v2] 카드 컴포넌트·카피 재설계. 사실·한정어는 원문 범위 유지"
      },
      "head": [
        "질문",
        "정하는 것"
      ]
    },
    {
      "page": 10,
      "type": "cta",
      "bg": "cream",
      "takeStyle": "bar",
      "oneMessage": "직접 준비할 범위와 종합 검토가 필요한 경계를 구분한다.",
      "headline": "직접 준비할 수 있는 경우, 함께 검토해야 하는 경우",
      "body": [
        "직접 준비 가능성이 높은 경우: 기존 글로벌 서비스, 하나의 자체등급분류 플랫폼, 명확한 등급·유통 구조",
        "종합 검토가 필요한 경우: 국내 퍼블리셔 계약, 여러 플랫폼 동시 출시, 청소년이용불가 가능성, 확률형 아이템·유료재화·복잡한 BM"
      ],
      "takeaway": "무료 검토에서는 서비스 국가·플랫폼·계약 구조만 있으면 등급분류·배급업 등록·국내대리인을 볼 순서를 확인합니다.",
      "pageTurn": "",
      "sourceTrace": {
        "heading": "직접 준비할 수 있는 경우와 전문가 검토가 필요한 상황",
        "paragraph": "글로벌 서비스를 이미 운영 중인 해외 개발사",
        "evidence": "I",
        "compressionNote": "직접 준비와 종합 검토의 경계를 마지막 판단 기준으로 배치"
      }
    }
  ]
}
